{
  "$schema": "https://json-schema.org/draft/2020-12/schema",
  "$id": "https://taktus.eu/contracts/shared/v1/Anchor.json",
  "title": "Anchor",
  "description": "An act that stays with a person regardless of the autonomy level of the rest of the process. Legal anchors cover legally binding acts; strategic anchors cover direction; correction anchors cover the correction of a result after it has left the system (ADR-0022). An anchor halts the run at a step boundary and raises a decision request. Every organisation defines its own set; the set can be reduced but never emptied. The decider is a role, never a named person. See docs/architecture/governance.md and ADR-0008.",
  "type": "object",
  "properties": {
    "id": { "type": "string", "minLength": 1 },
    "class": { "type": "string", "enum": ["legal", "strategic", "correction"] },
    "act": {
      "description": "The act kept with a person, in one sentence: payment release above 10,000 EUR; accepting or rejecting a feature.",
      "type": "string",
      "minLength": 1
    },
    "applies_to": {
      "description": "What triggers the anchor. At least one selector.",
      "type": "object",
      "properties": {
        "actions": {
          "description": "Tool actions, as capability patterns.",
          "type": "array",
          "items": { "$ref": "Capability.json#/$defs/pattern" },
          "minItems": 1,
          "uniqueItems": true
        },
        "processes": {
          "description": "Process identifiers.",
          "type": "array",
          "items": { "type": "string", "minLength": 1 },
          "minItems": 1,
          "uniqueItems": true
        },
        "risk_classes": {
          "description": "Risk classes as the organisation names them.",
          "type": "array",
          "items": { "type": "string", "minLength": 1 },
          "minItems": 1,
          "uniqueItems": true
        }
      },
      "minProperties": 1,
      "additionalProperties": false
    },
    "scope": {
      "description": "Where the anchor holds. Absent means everywhere in the tenant.",
      "type": "object",
      "properties": {
        "tenant": { "type": "string", "minLength": 1 },
        "domain": { "type": "string", "minLength": 1 },
        "jurisdiction": {
          "description": "ISO 3166-1 alpha-2 country code, optionally with a subdivision.",
          "type": "string",
          "pattern": "^[A-Z]{2}(-[A-Z0-9]{1,3})?$"
        }
      },
      "additionalProperties": false
    },
    "decider": {
      "type": "object",
      "properties": {
        "role": {
          "description": "The role that decides. The person is resolved at runtime.",
          "type": "string",
          "minLength": 1
        }
      },
      "required": ["role"],
      "additionalProperties": false
    }
  },
  "required": ["id", "class", "act", "applies_to", "decider"],
  "additionalProperties": false
}
